"Order Id","Cust Id","Cust Name","Boy Name","Cust Phone","Res Name","Item Total","Offer Price","Delivery Charge","Packaging Charge","Grand Total","Date and Time","Order details",MOP,"Delivery Type",status,"Cust Address"
VLR123177,60000591,"ARNAV RAI",Sathishs,7530000508,"LALIT VIHAR",805,0,50,55,910,2018-11-18,,tez,cod,"Order Finished","SH 59, Sevoor, Tamil Nadu 632106, India"
VLR123161,60001472,Nilu,Sathishs,9177286622,"BERRY'S BISTRO",1392,0,25,40,1457,2018-11-18,,cash,cod,"Order Finished","Hussainpura Mosque St, Bishop David Nagar, Hussainpura, Vellore, Tamil Nadu 632001, India"
VLR123079,60003306,aneesha,Sathishs,9597106761,"THE CHINA VALLEY",470,0,60,0,530,2018-11-18,,"Net Banking",ccavenue,"Order Finished","Bagayam, Vellore, Tamil Nadu 632002, India"
VLR123075,60000546,"Himanshu Singhal",Sathishs,9971714340,"WRAPS AND FRIES",80,0,30,5,115,2018-11-18,,tez,cod,"Order Finished","4th Cross Rd, Vaibhav Nagar, Katpadi, Vellore, Tamil Nadu 632014, India"
VLR123067,60000546,"Himanshu Singhal",Sathishs,9971714340,SWAGATH,80,0,30,5,115,2018-11-18,,tez,cod,"Order Finished","4th Cross Rd, Vaibhav Nagar, Katpadi, Vellore, Tamil Nadu 632014, India"
VLR123045,60000146,"Akhil Raj",Sathishs,8300639052,"THE VELLORE KITCHEN",162.75,0,30,7.75,201,2018-11-18,,cash,cod,"Order Finished","Kofi Annan Road, VIT University,Vellore, Tamil Nadu 632014"
VLR123043,60001033,"Shaikh Aakif ",Sathishs,8104842007,"RANGALAYA ROYAL",168,0,25,0,193,2018-11-18,,"Debit Card",ccavenue,"Order Finished","Kangayanellore Rd, Vaibhav Nagar, Katpadi, Vellore, Tamil Nadu 632014, India"
VLR123034,60001194,"himal shah",Sathishs,9099923281,"LALIT VIHAR",175,0,25,5,205,2018-11-18,,cash,cod,"Order Finished","Thottapalayam, Vellore, Tamil Nadu 632004, India"
VLR123011,60001588,siva,Sathishs,9442504510,"JOTHI BRIYANI",310,0,25,0,335,2018-11-18,,"Net Banking",ccavenue,"Order Finished","Servai Munisami Nagar, Selvampet, Vetapadi, Tamil Nadu 632001, India"
