restaurant_name,food_item,description,price,special_price,special_from,special_to,packaging_charge,status,available_from,available_to,breakfast_available_from,breakfast_available_to,lunch_available_from,lunch_available_to,dinner_available_from,dinner_available_to,available_days,item_status,image,main_cat,sub_cat,recommended,ingredients,cat_order,product_order
BOOMERANG,Vanilla Classic,A Simply Sweet And Classic Treat Of Nature'S Best Vinilla,47.25,,,,5,Veg,11.00AM ,11.00PM,,,,,,,"1,2,3,4,5,6,7",1,,Classic Softies,,0,,,
BOOMERANG,Choco Classic,Only The Firiest Cocoa Finds Its Way Into Our Classic Chocolate Softy,52.5,,,,5,Veg,11.00AM ,11.00PM,,,,,,,"1,2,3,4,5,6,7",1,,Classic Softies,,0,,,
BOOMERANG,Choco Vanilla Classic,The Elegant And Sophisticate Infution Of Our Creamy Classic,57.75,,,,5,Veg,11.00AM ,11.00PM,,,,,,,"1,2,3,4,5,6,7",1,,Classic Softies,,0,,,
BOOMERANG,Choco Top,Classic Vanilla Softy Wrapped In Luscious Hardening Chocolate,84,,,,5,Veg,11.00AM ,11.00PM,,,,,,,"1,2,3,4,5,6,7",1,,Classic Softies,,0,,,
BOOMERANG,Choco Ecleair,Classic Vanilla Softy Wrapped In Ribbons Of Fudge Sauce,68.25,,,,5,Veg,11.00AM ,11.00PM,,,,,,,"1,2,3,4,5,6,7",1,,Classic Softies,,0,,,
BOOMERANG,Butter Scotch Sundae,Classic Vanilla Softy Werapped In Homeade Butterschotch Sauce Topped Roasted Cashew Arid Drizzled With Praline,89.25,,,,5,Veg,11.00AM ,11.00PM,,,,,,,"1,2,3,4,5,6,7",1,,Classic Softies,,0,,,
BOOMERANG,Caramel Sundae,Classic Vanilla Softy With Swiets Of Goory Caramel Sauce Golden Delight,84,,,,5,Veg,11.00AM ,11.00PM,,,,,,,"1,2,3,4,5,6,7",1,,Classic Softies,,0,,,
BOOMERANG,Strawberry Sundae,Classic Vanilla Softy With Tangy Strawberry Crush Fit For The Summer Sun,73.5,,,,5,Veg,11.00AM ,11.00PM,,,,,,,"1,2,3,4,5,6,7",1,,Classic Softies,,0,,,
BOOMERANG,Mango Sundae,Mangoes Gone Wild On Our Classic Vanilla Softy,63,,,,5,Veg,11.00AM ,11.00PM,,,,,,,"1,2,3,4,5,6,7",1,,Classic Softies,,0,,,
BOOMERANG,Nutty Crunch,Classic Vanilla Softy Swirled With Luscious Fudge Sauce Topped With Roasted Cashew And Hard Chocolate,94.5,,,,5,Veg,11.00AM ,11.00PM,,,,,,,"1,2,3,4,5,6,7",1,,Classic Softies,,0,,,
BOOMERANG,Choco Mousse,Fluffy Chocolatey Goodness,68.25,,,,5,Veg,11.00AM ,11.00PM,,,,,,,"1,2,3,4,5,6,7",1,,Pastries,,0,,1,
BOOMERANG,Brownie,Rich Chewy Chocolate Cake Preferred By Cake Connoisseurs Everywhere,68.25,,,,5,Veg,11.00AM ,11.00PM,,,,,,,"1,2,3,4,5,6,7",1,,Pastries,,0,,,
BOOMERANG,Cheese Cake,Our Homemade Cheese Cake Made With Fresh Quark Cheese,115.5,,,,5,Veg,11.00AM ,11.00PM,,,,,,,"1,2,3,4,5,6,7",1,,Pastries,,0,,,
BOOMERANG,Panna Cotta,"Traditional Italian Dessert Of Sweetened Cream, Tastes Best With Caramel Topping",73.5,,,,5,Veg,11.00AM ,11.00PM,,,,,,,"1,2,3,4,5,6,7",1,,Pastries,,0,,,
BOOMERANG,Choco Fantasy Cack,,73.5,,,,5,Veg,11.00AM ,11.00PM,,,,,,,"1,2,3,4,5,6,7",1,,Pastries,,0,,,
BOOMERANG,Donuts,Go Nuts With Donuts,68.25,,,,5,Veg,11.00AM ,11.00PM,,,,,,,"1,2,3,4,5,6,7",1,,Pastries,,0,,,
BOOMERANG,Black Forest Cake,,73.5,,,,5,Veg,11.00AM ,11.00PM,,,,,,,"1,2,3,4,5,6,7",1,,Pastries,,0,,,
BOOMERANG,Blue Berry Cake,,73.5,,,,5,Veg,11.00AM ,11.00PM,,,,,,,"1,2,3,4,5,6,7",1,,Pastries,,0,,,
BOOMERANG,Red Velvet,,84,,,,5,Veg,11.00AM ,11.00PM,,,,,,,"1,2,3,4,5,6,7",1,,Pastries,,0,,,
BOOMERANG,Woffle Cone,,15.75,,,,5,Veg,11.00AM ,11.00PM,,,,,,,"1,2,3,4,5,6,7",1,,Extras,,0,,,
BOOMERANG,Extra Nuts,,26.25,,,,5,Veg,11.00AM ,11.00PM,,,,,,,"1,2,3,4,5,6,7",1,,Extras,,0,,,
BOOMERANG,Extra Toppings ,,15.75,,,,5,Veg,11.00AM ,11.00PM,,,,,,,"1,2,3,4,5,6,7",1,,Extras,,0,,,
BOOMERANG,Extra Ice Cream With Shakes,,31.5,,,,5,Veg,11.00AM ,11.00PM,,,,,,,"1,2,3,4,5,6,7",1,,Extras,,0,,,
BOOMERANG,Vanilla Shake,There'S Nothing Boring About This Old Classic Shake,99.75,,,,5,Veg,11.00AM ,11.00PM,,,,,,,"1,2,3,4,5,6,7",1,,Milkshakes,,0,,8,
BOOMERANG,Chocolate Shake,A Blend Of Creamy Chocolate Ice Cream And Our Homemade Fudge Sauce,99.75,,,,5,Veg,11.00AM ,11.00PM,,,,,,,"1,2,3,4,5,6,7",1,,Milkshakes,,0,,,
BOOMERANG,Butter Scotch Shake,A Blend Of Creamy Butterschotch Icecream Gamished With Praline,99.75,,,,5,Veg,11.00AM ,11.00PM,,,,,,,"1,2,3,4,5,6,7",1,,Milkshakes,,0,,,
BOOMERANG,Oreo Shake,A Blend Of Creame Vanilla With Oreo Gamished With Chocolate Sauce,168,,,,5,Veg,11.00AM ,11.00PM,,,,,,,"1,2,3,4,5,6,7",1,,Milkshakes,,0,,,
BOOMERANG,Nutella Shake,Experience The Unforgettable Combination Of Natella And Milkshake,168,,,,5,Veg,11.00AM ,11.00PM,,,,,,,"1,2,3,4,5,6,7",1,,Milkshakes,,0,,,
BOOMERANG,Strawberry ,Freshest Strawberry Blended With Icecream To Beat The Heat,115.5,,,,5,Veg,11.00AM ,11.00PM,,,,,,,"1,2,3,4,5,6,7",1,,Milkshakes,,0,,,
BOOMERANG,Power ,A Blend Of The Flnest And Wholesome Nuts With Milkshake Healthy Energizer,168,,,,5,Veg,11.00AM ,11.00PM,,,,,,,"1,2,3,4,5,6,7",1,,Milkshakes,,0,,,
BOOMERANG,Lychee,Freshest Lychees Blended With Icecream,126,,,,5,Veg,11.00AM ,11.00PM,,,,,,,"1,2,3,4,5,6,7",1,,Milkshakes,,0,,,
BOOMERANG,Badam,Real Almond Sauce Blended With Icecream,99.75,,,,5,Veg,11.00AM ,11.00PM,,,,,,,"1,2,3,4,5,6,7",1,,Milkshakes,,0,,,
BOOMERANG,Browine Shake,A Blend Of Belgium Chocolate Ice Cream With Browries Chocolate Lovers Treat.,168,,,,5,Veg,11.00AM ,11.00PM,,,,,,,"1,2,3,4,5,6,7",1,,Milkshakes,,0,,,
BOOMERANG,Mixed Berry Shake ,A Blend Of Canilla Ice Icream With Strawberry And Blueberries,168,,,,5,Veg,11.00AM ,11.00PM,,,,,,,"1,2,3,4,5,6,7",1,,Milkshakes,,0,,,
BOOMERANG,Marshmallow Chocolate Shake,A Blend Of Chocolate Ice Cream With Marshmallows Kids Love It,168,,,,5,Veg,11.00AM ,11.00PM,,,,,,,"1,2,3,4,5,6,7",1,,Milkshakes,,0,,,
BOOMERANG,Cold Coffee Shake,A Blend Of Freeze Dried Coffee With Ice Cream,115.5,,,,5,Veg,11.00AM ,11.00PM,,,,,,,"1,2,3,4,5,6,7",1,,Milkshakes,,0,,,
BOOMERANG,Mango,Fresh Mango Pulp Blended With Ice Cream,99.75,,,,5,Veg,11.00AM ,11.00PM,,,,,,,"1,2,3,4,5,6,7",1,,Milkshakes,,0,,,
BOOMERANG,Black Forest Dream,Loads Of Classic Choco Vanilla Softy Placed On Fresh Blackforest Cake With Swirls Of Fudge Sauce And Topped With Roasted Cashew,294,,,,5,Veg,11.00AM ,11.00PM,,,,,,,"1,2,3,4,5,6,7",1,,Take Home Packs,,0,,3,
BOOMERANG,Fruit & Sundae,Loads Of Classic Vanilla Softy Generoulsy Topped With A Decadent Variety Of Resh Fruits And Wholesome Nuts Garnishews With Strawberry Sauce,294,,,,5,Veg,11.00AM ,11.00PM,,,,,,,"1,2,3,4,5,6,7",1,,Take Home Packs,,0,,,
BOOMERANG,Dry Fruits Island,"Loads Of Classic Vanilla With The Finest Roasted Cashw, Almonds, Fings (Anneer) And Raisins Finished With Home Black Currant And Orange Sauces",294,,,,5,Veg,11.00AM ,11.00PM,,,,,,,"1,2,3,4,5,6,7",1,,Take Home Packs,,0,,,
BOOMERANG,Butter Scotch Caramel,Loads Of Classic Vanilla Softy Wrapped In Our Homemade Butterschotch Sauve Topped With Roasted Cashew And Drizzled With Pralines,262.5,,,,5,Veg,11.00AM ,11.00PM,,,,,,,"1,2,3,4,5,6,7",1,,Take Home Packs,,0,,,
BOOMERANG,Vanilla Family Pack,"It'S The Most Popular Flavour On The Planet, And Our Vanilla Is The Creamiest Anywere",189,,,,5,Veg,11.00AM ,11.00PM,,,,,,,"1,2,3,4,5,6,7",1,,Take Home Packs,,0,,,
BOOMERANG,Choco Vanilla Family Pack,Vanilla And Chocolate Twisted Together ,210,,,,5,Veg,11.00AM ,11.00PM,,,,,,,"1,2,3,4,5,6,7",1,,Take Home Packs,,0,,,
BOOMERANG,Nutty Crunch Famuly Pack,Choco Vanilla Twist Layered With Cashew Nuts And Swirled With Fudge Sauce And Hot Chocolate Dip,294,,,,5,Veg,11.00AM ,11.00PM,,,,,,,"1,2,3,4,5,6,7",1,,Take Home Packs,,0,,,
BOOMERANG,Black Forest Pleasure,Classic Choco Vanilla Softy Placed On Fresh Black Forest Cake With Swirls Of Fudge Sauce And Topped With Roasted Cashew,162.75,,,,5,Veg,11.00AM ,11.00PM,,,,,,,"1,2,3,4,5,6,7",1,,Signature Sundaes,,0,,4,
BOOMERANG,Mix Fruit Caramel,Classic Vanilla Softy With Swirls Of Fruit Sauce Covered In Fruits And Praline,147,,,,5,Veg,11.00AM ,11.00PM,,,,,,,"1,2,3,4,5,6,7",1,,Signature Sundaes,,0,,,
BOOMERANG,Jelly Jellos,Fruit Jellies Placed On Vanilla Softy And Dotted With Strawberry Sauce Just For Kids,110.25,,,,5,Veg,11.00AM ,11.00PM,,,,,,,"1,2,3,4,5,6,7",1,,Signature Sundaes,,0,,,
BOOMERANG,Get Smart ,"Get Smarter With Mounds Of Vanilla Softy Placed Over Fresh Blackforest Cake Topped With Roasted Cashew And Fruits Finished With Swirls Of Fudge Sauce, Strawberry Sauce And Mango Sauce",173.25,,,,5,Veg,11.00AM ,11.00PM,,,,,,,"1,2,3,4,5,6,7",1,,Signature Sundaes,,0,,,
BOOMERANG,Fruit Salad,"Fruity Treat Of Vanilla Softy Topped With Cherries, Lychess, Papaya, Pineapple And Our Homemade Fruit Sauce",147,,,,5,Veg,11.00AM ,11.00PM,,,,,,,"1,2,3,4,5,6,7",1,,Signature Sundaes,,0,,,
BOOMERANG,Hot Fudge Nut Sundae,Generous Portion Of Classic Vanilla Softy With Swirls Of Fudge Sauce And Topped With Roasted Cashew And Praline,147,,,,5,Veg,11.00AM ,11.00PM,,,,,,,"1,2,3,4,5,6,7",1,,Signature Sundaes,,0,,,
BOOMERANG,Love Lychee ,Treat Your Loved One With Our Lovely Vanilla Softy Set Over Lychees And Strawberry Topping,152.25,,,,5,Veg,11.00AM ,11.00PM,,,,,,,"1,2,3,4,5,6,7",1,,Signature Sundaes,,0,,,
BOOMERANG,Protein Blast,Vanilla Softy Generoulsy Topped With A Decadent Variety Of Fruits And Wholesome Nuts Garnished With Strawberry Sauce Nutritious,162.75,,,,5,Veg,11.00AM ,11.00PM,,,,,,,"1,2,3,4,5,6,7",1,,Signature Sundaes,,0,,,
BOOMERANG,Oreo - Nutella,Classic Vanilla Softy Loaded With Oreo Biscuits With Swirls Of Our New Nutella Topping - Sinful,168,,,,5,Veg,11.00AM ,11.00PM,,,,,,,"1,2,3,4,5,6,7",1,,Signature Sundaes,,0,,,
BOOMERANG,Special Dry Fruit Sundae,"Loads Of Classic Vanilla Softy With The Finest Roasted Cashew, Almonds, Figs (Anjeer) And Raisins Finished With Homemade Black Currant And Orange Sauces",162.75,,,,5,Veg,11.00AM ,11.00PM,,,,,,,"1,2,3,4,5,6,7",1,,Signature Sundaes,,0,,,
BOOMERANG,Titanic Boat ,"Inspired By James Cameron'S, Titanic With Black Forest Cake, Two Nelegant Vanilla Softys With Chocolate Fugde Swirls, Roasted Cashew And Fresh Fruit Salat With Fruit Swirls Sail On This Love Boat Powered By Our Mini Badam Shake",189,,,,5,Veg,11.00AM ,11.00PM,,,,,,,"1,2,3,4,5,6,7",1,,Something Different,,0,,,
BOOMERANG,Belgium Wolffle With Maple Syrup,Freshly Baked Waffie Served With Scoop Of Vanilla Ice Cream Topped With Maple Syrup,183.75,,,,5,Veg,11.00AM ,11.00PM,,,,,,,"1,2,3,4,5,6,7",1,,Something Different,,0,,,
BOOMERANG,Banana Split,"Three Scoops Of Vanilla, Chocolate And Strawberry Nestled Between A Fresh, Split Banana With Swirls Of Chocolate Fudge, Fresh Strawberry Crush And Topped With Roasted Cashew",204.75,,,,5,Veg,11.00AM ,11.00PM,,,,,,,"1,2,3,4,5,6,7",1,,Something Different,,0,,,
BOOMERANG,Belgium Walffle With Mixed Berries,Freshly Baked Waffle Served With Scoop Of Vanilla Ice Cream Topped With Strawberry And Blueberry,183.75,,,,5,Veg,11.00AM ,11.00PM,,,,,,,"1,2,3,4,5,6,7",1,,Something Different,,0,,,
BOOMERANG,Nutello Walffle,Freshly Baked Waffle Served With Scoop Of Vanilla Ice Cream Swirled With Nutefla,210,,,,5,Veg,11.00AM ,11.00PM,,,,,,,"1,2,3,4,5,6,7",1,,Something Different,,0,,,
BOOMERANG,Browine Earthquake,Large Scoop Of Creamy Vanilla Ice Cream Placed Over Warm Browine With Swirls Of Fudge Sauce And Roast Cashw Topping Worth The Calories,162.75,,,,5,Veg,11.00AM ,11.00PM,,,,,,,"1,2,3,4,5,6,7",1,,Chocolicious,,0,,2,
BOOMERANG,Double Fudge Brownie ,Large Scoop Of Creamy Chocolate Ice Cream Placed Over Warm Brownie With Swirls Of Fudge Sauce And Roasted Cashew Topping By Chocolate,173.25,,,,5,Veg,11.00AM ,11.00PM,,,,,,,"1,2,3,4,5,6,7",1,,Chocolicious,,0,,,
BOOMERANG,Crispy Choco Crunch,A Scoop Of Chocolate Ice Cream With Fudge Sauce Swirls Topped With Chocolate Corn Flakes And Roasted Chew For Those Chocolivious Kids,115.5,,,,5,Veg,11.00AM ,11.00PM,,,,,,,"1,2,3,4,5,6,7",1,,Chocolicious,,0,,,
BOOMERANG,Mud Cake With Ice Cream,Scoop Of Creamy Vanilla Ice Cream Sperved With Coffee Mud Cake And Topped With Coffee Fude Sauce,173.25,,,,5,Veg,11.00AM ,11.00PM,,,,,,,"1,2,3,4,5,6,7",1,,Chocolicious,,0,,,
BOOMERANG,Brownie Sizzler,Warm Brownie Placed On A Scoop Of Creamy Vanilla Ice Cream Topped With Roasted Cashew And Served With Fudge Sauce Served Hot And Sizzling With Goodness,189,,,,5,Veg,11.00AM ,11.00PM,,,,,,,"1,2,3,4,5,6,7",1,,Chocolicious,,0,,,
BOOMERANG,Caramel Brownie Ice Cream,Large Scoop Of Vanilla Ice Cream Placed Over Warm Caramel Brownie With Swirls Of Fudge  Sauce And Roasted Cashew,168,,,,5,Veg,11.00AM ,11.00PM,,,,,,,"1,2,3,4,5,6,7",1,,Chocolicious,,0,,,
BOOMERANG,Choco Lava Cake With Ice Cream,Large Scoop Of Vanilla Ice Cream Served With Warm Choco Lava Cake And Fudge Sauce Sinfully Delicious,178.5,,,,5,Veg,11.00AM ,11.00PM,,,,,,,"1,2,3,4,5,6,7",1,,Chocolicious,,0,,,
BOOMERANG,Red Velvet Ice Cream,,94.5,,,,5,Veg,11.00AM ,11.00PM,,,,,,,"1,2,3,4,5,6,7",1,,New Arrivals,,0,,5,
BOOMERANG,Oreo Ice Cream ,,94.5,,,,5,Veg,11.00AM ,11.00PM,,,,,,,"1,2,3,4,5,6,7",1,,New Arrivals,,0,,,
BOOMERANG,Belgium Chocolate,,94.5,,,,5,Veg,11.00AM ,11.00PM,,,,,,,"1,2,3,4,5,6,7",1,,New Arrivals,,0,,,
BOOMERANG,Pinacolada,,94.5,,,,5,Veg,11.00AM ,11.00PM,,,,,,,"1,2,3,4,5,6,7",1,,New Arrivals,,0,,,
BOOMERANG,Sitaphal,,94.5,,,,5,Veg,11.00AM ,11.00PM,,,,,,,"1,2,3,4,5,6,7",1,,New Arrivals,,0,,,
BOOMERANG,Banana Blueberry,,94.5,,,,5,Veg,11.00AM ,11.00PM,,,,,,,"1,2,3,4,5,6,7",1,,New Arrivals,,0,,,
BOOMERANG,Tender Coconut,,94.5,,,,5,Veg,11.00AM ,11.00PM,,,,,,,"1,2,3,4,5,6,7",1,,New Arrivals,,0,,,
BOOMERANG,Creamy Vanilla (Regular),,73.5,,,,5,Veg,11.00AM ,11.00PM,,,,,,,"1,2,3,4,5,6,7",1,,Scoops,,0,,6,
BOOMERANG,Creamy Chocolate (Regular),,73.5,,,,5,Veg,11.00AM ,11.00PM,,,,,,,"1,2,3,4,5,6,7",1,,Scoops,,0,,,
BOOMERANG,Real Strawberry (Regular),,73.5,,,,5,Veg,11.00AM ,11.00PM,,,,,,,"1,2,3,4,5,6,7",1,,Scoops,,0,,,
BOOMERANG,Creamy Butterscotch (Regular),,73.5,,,,5,Veg,11.00AM ,11.00PM,,,,,,,"1,2,3,4,5,6,7",1,,Scoops,,0,,,
BOOMERANG,Pistachio (Regular),,94.5,,,,5,Veg,11.00AM ,11.00PM,,,,,,,"1,2,3,4,5,6,7",1,,Scoops,,0,,,
BOOMERANG,Raw Manfo Lemon (Regular),,94.5,,,,5,Veg,11.00AM ,11.00PM,,,,,,,"1,2,3,4,5,6,7",1,,Scoops,,0,,,
BOOMERANG,Black Currant (Regular),,73.5,,,,5,Veg,11.00AM ,11.00PM,,,,,,,"1,2,3,4,5,6,7",1,,Scoops,,0,,,
BOOMERANG,Fig-O-Honey (Regular),,73.5,,,,5,Veg,11.00AM ,11.00PM,,,,,,,"1,2,3,4,5,6,7",1,,Scoops,,0,,,
BOOMERANG,Cherry Merry (Traditional),,73.5,,,,5,Veg,11.00AM ,11.00PM,,,,,,,"1,2,3,4,5,6,7",1,,Scoops,,0,,,
BOOMERANG,Real Lychee (Traditional),,94.5,,,,5,Veg,11.00AM ,11.00PM,,,,,,,"1,2,3,4,5,6,7",1,,Scoops,,0,,,
BOOMERANG,Real Mango (Traditional),,73.5,,,,5,Veg,11.00AM ,11.00PM,,,,,,,"1,2,3,4,5,6,7",1,,Scoops,,0,,,
BOOMERANG,Rosewater Honey Walnut (Traditional),,94.5,,,,5,Veg,11.00AM ,11.00PM,,,,,,,"1,2,3,4,5,6,7",1,,Scoops,,0,,,
BOOMERANG,Caramel Almond Crunch (Western),,94.5,,,,5,Veg,11.00AM ,11.00PM,,,,,,,"1,2,3,4,5,6,7",1,,Scoops,,0,,,
BOOMERANG,Cotton Candy (Western),,84,,,,5,Veg,11.00AM ,11.00PM,,,,,,,"1,2,3,4,5,6,7",1,,Scoops,,0,,,
BOOMERANG,Caramel Pop Corn (Western),,94.5,,,,5,Veg,11.00AM ,11.00PM,,,,,,,"1,2,3,4,5,6,7",1,,Scoops,,0,,,
BOOMERANG,Cookies & Cream (Western),,94.5,,,,5,Veg,11.00AM ,11.00PM,,,,,,,"1,2,3,4,5,6,7",1,,Scoops,,0,,,
BOOMERANG,French Vanilla (Western),,94.5,,,,5,Veg,11.00AM ,11.00PM,,,,,,,"1,2,3,4,5,6,7",1,,Scoops,,0,,,
BOOMERANG,Bubble Gum (Western),,73.5,,,,5,Veg,11.00AM ,11.00PM,,,,,,,"1,2,3,4,5,6,7",1,,Scoops,,0,,,
BOOMERANG,Mocha Brownie (Western),,94.5,,,,5,Veg,11.00AM ,11.00PM,,,,,,,"1,2,3,4,5,6,7",1,,Scoops,,0,,,
BOOMERANG,Coffee Chocolate Chip (Western),,84,,,,5,Veg,11.00AM ,11.00PM,,,,,,,"1,2,3,4,5,6,7",1,,Scoops,,0,,,
BOOMERANG,Triple Caramel (Western),,94.5,,,,5,Veg,11.00AM ,11.00PM,,,,,,,"1,2,3,4,5,6,7",1,,Scoops,,0,,,
